@matheus_santo9 ; Você é livre pra fazer o que quiser, desde que não interfira no direito do outro. Não concorda com a doutrina da igreja católica? Não seja um católico. Mas não saia falando asneiras da mãe igreja e ainda se dizendo católico.;1581618114000;5
@nandoarvianna ; @mariozinholago Não sou a favor. Sou Umbandista e acho que isso dá mais munição para os fundamentalistas evangélicos. É um prato cheio pra eles. Era melhor fazer uma marcha contra a Igreja Unversal, que foi expulsa  de Uganda, se não me engano! Ela é a grande responsável por tudo isso!;1581618105000;5
@chloecthulhu ; @yinlua_ creio q mts vezes as pessoas da igreja n ajudam mt um g@y optar pelo celibato. cristãos no geral tratam  como algo penoso e o casamento/família como o auge da felicidade. Assim fica difícil considerar a opção, a pessoa já se enxerga morrendo sem nenhuma alegria na vida.;1581618061000;5
@Invencionando ; @lpbragancabr @hbredda A derrocada da Igreja Católica no Brasil, vem a passos largos qdo juntou se aos movimentos sem terra, com a real intenção de transcrever a bíblia e realizar literalmente uma guerra santa por terra, por divisão de terra, dos proprietários para os invasores.;1581618045000;5
@IsaiasWanderley ; @Pontifex_pt Se fosse o Papa João Paulo II esta patifaria de receber e endeusar ditadores não aconteceria. Aquele é e sera o único  papa da igreja católica.;1581618038000;5
@Samaraaguiarr_ ; as irmãs da igreja agora perguntam pra mamãe se a filha delas são também, aí mamãe “samara tu acha “;1581617994000;5
@MarioBarletto ; @terca_livre MEU COMPANHEIRO LULU ,SEU DINHEIRO  Q VC ROUBOU DOS POVO DO BRASIL TA GUARDADO ,MAS NÃO SE ESQUEÇA DOS 10% DA IGREJA Q VC  PROMETEU ,DEUS TE ABENÇÕE FILHO .....;1581617958000;5
@caramelonapipok ; Fiquei p morrer vendo o senhorzinho no auge dos seus 60 anos de bermuda e camiseta em boa viagem, na igreja da sé e nas ladeiras de Olinda HAHHAHAHA;1581617899000;5
@Beatriz49576941 ; @Titus_Magnus @Pontifex_pt falei por vc, eu sou católica honesta e esse Papa só me dá orgulho de ser católica e progressista,como ele e a igreja q ele representa,vergonha eu teria se ele apoiasse governo d milicianos e fascistas;1581617888000;5
@EuDouglasBr ; Lamento pelo que a Igreja Católica  se tornou, na figura de seu papa atual, que seguidamente se mostra a favor do comunismo, recebendo o presidente da Argentina e agora o ex-presidente mais corrupto da história do Brasil e mentiroso contumaz, Lula.#LulaComFrancisco https://t.co/RqxzKn2uem;1581617872000;5
@atofalando ; O Papa "herege" e o líder da seita criminosa se encontram...https://t.co/iDbNABi0Dh;1581617830000;5
@rafaelitaipava ; @folha @monicabergamo E vivi para ver a esquerda, essa cambada que só vive na esbórnia e na escória, que adoram debochar dos cristãos, ficarem se vangloriando de que o deus (em minúsculo mesmo) deles foi se encontrar com o Papa, o representante máximo da igreja católica... É muita hipocrisia mesmo!;1581617793000;5
@mariannamissawa ; Eu não sigo religião nenhuma! Eu acredito em Deus, mas esse negócio de frequentar um lugar só pra adorar meu Deus é um saco mano! Igreja só serve pra arrancar dinheiro dos outros se aproveitando da fé, e não só igreja assim como outras instituições religiosas;1581617791000;5
@ClodomirSilva3 ; @JoseMedeirosMT A verdade sempre se revelará e libertará. Viva "Hans River" até da igreja! https://t.co/pXcwS4Dt4r;1581617743000;5
@arq_oposicao ; @RComoediae @VEJA Ele na verdade deve ter vergonha de gente que se diz católica e usa o nome de Jesus pra se promover politicamente. Ah também deve sentir vergonha de quem faz arma com a mão em marcha da igreja.Sente vergonha também quando um católico diz que empregada na Disney é bagunça;1581617709000;5
@djeniferrgab ; *um cavalo na frente da igreja*minha irmã: ala mana, ele tá se abençoando;1581617681000;5
@AzamorSantos1 ; @jandira_feghali Dragão da Odebrecht, a igreja católica de Roma tem perdido inúmeros fiéis exatamente por apoiar bandidos e ditadores. As pessoas do BEM jamais posariam ao lado de um criminoso condenado, como se dessem suporte aos seus crimes. Esse Papa envergonha os verdadeiros cristãos. https://t.co/mm5ech6u45;1581617641000;5
@RgisMonteiro3 ; @DavySaviani @RenanPeixoto_ Meu jovem, não se esqueça... o papel da igreja é dar perdão e compreender todos os pecadores e ladrões filha da puta!;1581617639000;5
@ThePuni65844302 ; @Pontifex_pt Papa vagabundo progressista vc é a vergonha da igreja católica ATENÇÃO fiéis Belzebu anda pelos corredores do Vaticano não se deixem enganar porq Deus não habita mais ali https://t.co/3t9uxOYMll;1581617565000;5
@Renatarl1 ; @bernardopkuster Sou Católica e digo q essa papa não me representa.Continuarei apoiando a Igreja pois acredito q se nós, católicos que somos o corpo da igreja, estivermos unidos passaremos por esse impostor.;1581617552000;5
@sickpierre ; a missa nova é dividida entre os ritos iniciais, liturgia da palavra e liturgia eucarística, sempre reverente ao sagrado e sublimeo homem ao entrar na igreja deve retirar seu chapéu/boné em sinal de respeito, fazer a genuflexão e o sinal da cruz antes de ir se sentar;1581617437000;5
@SystemTitanium ; @bernardopkuster Tem algo muito errado nesse erro. Deus, Jesus e Nossa Senhora tenham misericórdia dos Cristãos Católicos e da Santa Igreja.Isso é um escândalo  o Bergoglio aparecendo ao lado de um criminoso que não se arrepende só  reforça que fazer o mal compensa.;1581617436000;5
@antoniopossamai ; @rabilos @brasil34pol @bernardopkuster O catolicismo desvirtuou? Se foi a própria Igreja que definiu os livros que eram sagrados. Você apenas lê os livros autorizados pela Igreja para fazer um show de horrores de interpretação pessoal e colaborar para a desconstrução da verdade. Você é revolucionário como o pt.;1581617261000;5
@nkegles ; @ptbrasil @LulaOficial @Pontifex_ln Se o @ptbrasil ou @LulaOficial tivessem preocupados com a redução da fome, não tinham roubado todo o Brasil. #LulaComFrancisco é uma aberração visitando outra, na Igreja se corrige um papa com outro papa, no Brasil corrigimos Lula com Bolsonaro!;1581617077000;5
@JornalDaCidadeO ; O Papa "herege" e o líder da seita criminosa se encontram...https://t.co/P8uyV3SqzF;1581617039000;5
@Pat_LerPorAi ; @jmgvostpt Tens toda a razão e esse é o meu ponto. O lado do não está empenhado na desinformação.Até eu, q sou pelo sim, tenho melhores argumentos pelo "não". Ir a referendo é deixar essa propaganda vencer porque não é em 1 ano que se apaga a influência da Igreja em algumas comunidades.;1581617028000;5
@yvanacampos ; @diego_lo2039 Creio que já é. Muitos católicos migraram para as igrejas evangélicas por causa das parcialidade de alguns padres.Sou evangélica, já fui católica e assim como eu muita outras pessoas, se decepcionaram com certas atitudes de padres e da própria igreja.;1581617005000;5
@TajraAdriana ; @claudioedantas Esse capeta tenta se aproximar dos evangélicos, agora dos católicos.Aí tem!Essa turma não dá ponto sem nó.O que não aceito é a Igreja,enquanto Instituição q representa os tementes à Deus,abençoa esse herege q  professa doutrinas contrárias aos nossos dogmas #NãoRoubarás;1581616973000;5
@BRUNORAPHAELSI3 ; @lpbragancabr O problema é que os dirigentes da igreja católica são comunistas, enquanto que os católicos em si são conservadores, como eu por exemplo. Há de se ter cuidado com certas coisas a se falar, "princepe".;1581616932000;5
@monicalual ; @terca_livre No enterro de Joao Paulo II, Lula foi pra fila da comunhão e depois um jornalista perguntou se ele tinha se confessado e ele disse: “ Eu não tenho pecado!”.Triste dia para a Igreja Católica da qual faço parte.Mas minha fé não está fundada em homens, mas em Jesus.;1581616895000;5
@flavia_badaro ; @nostrendsbrasil @LulaOficial @Pontifex_pt que absurdo! por isso que cada vez mais as pessoas se afastam da igreja católica! Como pode o @Pontifex_pt receber um sujeito que roubou tanto! É um soco na cara dos brasileiros de bem.😡😠;1581616859000;5
@Eunice8 ; @Rconstantino O pior é esse representante máximo da igreja católica recebê-lo....como é? Não tem informações sobre de quem se trata ou tem e compactua com seus atos?;1581616781000;5
@pedrorex2009 ; @carloscezarcjr É por que esse Papa é um falso Papa. Um fantoche de Lúcifer e dos comunistas. Apenas assim para o líder da Santa Igreja Católica, se associar com um ladrão, mentiroso e assassino.;1581616736000;5
@lucasrrmedeiros ; “Sê uma igreja fiel ao amor, fiel à palavra do Evangelho, as leis do amor fraterno! Então serás um testemunho da presença de Deus, crescerás, viverás e vencerás.” Cardeal Van Thuan;1581616642000;5
@jeanlusca ; se minha mãe vê eu me matando de rir desse vídeo as irmã da igreja tudo vem orar por mim SIRIANDA LANAPRAIA https://t.co/QfUWqnovVM;1581616612000;5
@mito_2020 ; @Pontifex_pt Recebendo ladrão, criminoso, presidiário, corrupto e ateu???? Belo líder da igreja católica!!! João Paulo II  deve estar se revirando no túmulo!!! https://t.co/BNuu9PB1IR;1581616610000;5
@CariocaViking ; @carteiroreaca Que cena patética do @Pontifex_pt Com o luladrão @LulaOficial ...Depois não sabem os motivos pelos quais as pessoas se afastam da igreja católica...;1581616516000;5
@MZeuda ; @Pontifex_pt O povo da Amazônia já conhece o evangelho verdadeiro, se depender de tu eles nunca conhecerá já que a igreja não prega a verdade.Comunista excumugado;1581616480000;5
@oreissamir ; @Bolsoneas @jairbolsonaro Satanás se aproxima da igreja católica.;1581616340000;5
@bruno92_sccp ; falam mal um tanto da igreja evangélica por causa de uns que a corrompem ( Edir Macedo, Valdemiro Santiago, Silas Malafaia ) mas esse Papa aqui só se encontra com pessoas desse nível... https://t.co/9Ia8SAAMsm;1581616258000;5
@atilasantos06 ; @SousaElias40 Não sou religioso, mas sinceramente, a igreja católica tá na lama, apesar dos seus fieis devotos, pessoas do bem. Se o líder da igreja tá apertando a mão do maior bandido desse país... tá feio o negócio. Sem mencionar que esse mesmo Papa já recebeu até o Maduro;1581616175000;5
@pdfernandess ; ontem vieram uns cara da igreja bater na minha porta p ficar falando n sei oq dai eles me perguntaram se eu acredito na bíblia eu disse q nao eles ficaram assustados;1581615977000;5
@Fernomeno05 ; #LulaComFrancisco Algum Lider da Igreja Católica aderiu a esse movimento? @CNBBNacional  algo a se dizer?;1581615865000;5
@EvandroGuilhe12 ; "Vá e não peques mais..."Jesus ama o pecador mas odeia o pecado.Arrependimento é o que o ex-presidiário não aparenta ter. Ainda pecando e se tiver a chance vai voltar a roubar mais.Só lamento o Papa Francisco receber um bandido não arrependido, fazendo da Igreja um comício...;1581615862000;5
@edimiranduar1 ; @lpbragancabr A família real BR nunca foi religiosa,sempre usou a igreja apenas p se manter no poder,mesmo quando está ainda não era aparelhada pela esquerda, tanto é q traiu a santa sé e caiu nos braços da maçonaria e dos militares,o resultado nós vimos em 15/11/1889;1581615836000;5
@jmgvostpt ; Ponto prévio: sou a favor da eutanásia. Ponto prévio: Acho que é uma questão que se deve referendar. Sei que o grande receio de levar esta questão a referendo tem muito a ver com a posição pública já tomada por dois grandes mobilizadores: A Igreja Católica e o PCP;1581615729000;5
@Taissandradee ; @kldgic @ForsterFr realmente, eu acredito, e defendo os dogmas da minha igreja, e informo, mas não posso fazer nada se as pessoas não concordam, a minha função eu fiz, que foi informar.;1581615607000;5
@AfonsoPantoja ; @Pontifex_pt A Amazônia é do Brasil.  Se quer debater sobre ela procure o mandatário máximo da nação e não quem foi condenado por corrupção. Infelizmente a igreja é mal representada.;1581615493000;5
@Mlodi ; Esperando frases do tipo (em 3, 2 ,1...)"Papa é comunista""Papa da esquerda""Lula é sócio do Papa""A Igreja católica fechou com o PT"" @zehdeabreu não foi pra Nova Zelândia. Está no Vaticano e vai se tornar Papa em breve";1581615442000;5
@dedeco01 ; @VEJA Uma vergonha um Papa que se diz Catolico,e que expressa crer em Deus,receber um Condenado desse.É o fim da Igreja Católica.Voce me envergonha Chico!!!!;1581615376000;5
@Camilinhaaa_97 ; Tenho uns parentes que são da igreja que se acham donos da verdade. Vem falar gracinha vai ouvir gracinha, eu em!;1581615246000;5
@naovalemais ; @rabilos @bernardopkuster O Papa é o sucessor de São Pedro e chefe da minha Igreja. O Papa não está se aliando ao PT, para com isso. Ele já recebeu o Trump também, bem como outros líderes das mais distintas ideologias.;1581615187000;5
@medeirosub ; @RobertoPegoraro @mariadorosario @LulaOficial @Pontifex_pt Não era Lula que até pouco tempo atrás se comparada com Jesus Cristo? Na hierarquia da igreja Lula é quem devia estar abençoando o papa. Agora Lula me deixou confuso! 🤔;1581615108000;5
@Maguis_Coalla ; Jikook-AU!Onde todo ano novo, assim que o Sino da igreja toca, todos os cidadões de Seul perdem a memória. Jeon Jungkook e Park Jimin são almas gêmeas que todo ano tem a missão de se reencontrar e se apaixonar novamente até a maldição ser quebrada. https://t.co/qJIO5MWxh7;1581615096000;5
@RafaelloRibeiro ; o Papa se encontrou com o Lula.Queria muito saber a opinião d galera da igreja que são fãs do Bolsonaro.;1581614993000;5
@Ricardo82024195 ; @LulaOficial Vc não  me surpreende em nada, mas esse papa deu o tiro de Misericórdia no resquício de credibilidade que ele ainda tinha. Se rebaixou aos porões da igreja se misturando a ladrões e corruPTos.;1581614910000;5
@rosa_sathler ; Meus amigos católicos romanos ajudem a limpar a igreja, não se pode ter um líder q só dá apoio a bandidos, corruptos e marginais, vejam hj, o papa recebeu o corrupto condenado Lula. https://t.co/040Fnj2Tfh;1581614789000;5
@cardeal_rodrigo ; @VEJA O cara é banido. Só está solto por manobra do STF. É réu em vários inquéritos. Recebe dinheiro da nação. E consegue visitar a entidade máxima da igreja católica. Passear  livre em Roma e postar foto como se tudo fosse normal ! Acorda Brasil !;1581614720000;5
@RosanaMeneghini ; Hj meu coração ficou mais machucadoA história da igreja católica ñ pode ser manchadaO Papa pode e DEVE receber qualquer alma penitente. PENITENTEO q se proclama alma + honesta do mundo, condenado em 2 instânciar, inclusive nao me parece arrependido dos crimes e pecados q comey https://t.co/tbafDcyNwi;1581614632000;5
@hinaprotect ; e minha amiga ainda vem me dizer que se eu não concordo com tudo que as pessoas da igreja dizem, não posso nem me considerar católica. pois tenho é orgulho de não ser rsrs https://t.co/R93vyp1RX6;1581614505000;5
@sidneyasc ; Inacreditável!Alguém que enaltece uma ideologia que prega a destruição das igrejas ser recebido pelo Papa. Eu como cristão não reconheço mais o @Pontifex_pt como o líder da Igreja Católica ./Papa Francisco se encontra com Lula no Vaticano | Mundo | G1/ https://t.co/HH7yzSXf5E;1581614318000;5
@ckcorreia1965 ; @Pontifex_pt Lamentável! A Igreja não aprendeu com o seu pobre passado de se juntar aos corruptos e criminosos. Agora, o que vemos, menos católicos acreditam neste papa. Receber um criminoso condenado e lhe dar a benção. Porque não cobrou esse seu sonho a ele? Porque lembra da Amazônia agora?;1581614317000;5
@SarinhaNMB ; @joaovitorlento @Pabluneves @Na_Igreja @pefabiodemelo Kkkkkk ah, sim.Foi uma militância desnecessária referente a alguns de seus tts, como ele havia se recuperando recentemente da depressão, preferiu evitar um ambiente que estava se tornando hostil.;1581614098000;5
@PhantomasBlip ; @CNBBNacional Nenhum comentário sobre o Papa recebendo o Luís da Silva? Eu posso entender. Dá vergonha comentar não é mesmo? Se tivessem coragem, diriam algo, de preferência a verdade. Porque esse Papa está dizimando a reputação da Igreja e vocês sabem disso.;1581614059000;5
@adrianosantarem ; @freianastaciopt Tinha  quebrar ser um padre pra estar na esquerda e se colocar dessa forma contra as ações governamentais, vcs deveriam vender todas as terras da igreja católica e dar aos pobres, vcs só são bons no discurso agora nas ações, são tristes !!!;1581613749000;5
@SEP1CM ; @woshingtonrs Você é Católico? A igreja Católica tem história e tradição,  o Celibatário tem mais de 1000 anos, é uma lei dentro da igreja, foi no segundo concílio de Latrão ( reunião de Bispos), ao longo do século 12, que se estabelece a obrigatoriedade definitiva do celibato.Não foi a toa.;1581613560000;5
@Veio_Sonso ; @rezende Um "jornal" gerado no seio do Olavo da Carvalho, era de se esperar tal postura. Concordo, nada melhor do que rezar pelo Sto. Padre. Pior que isso, são aquelas pessoas que se dizem católicas, mas dizem que "Bergólglio" não os representa, como se estes estivessem acima da Igreja.;1581613545000;5
@claudiasrocca ; @claudioedantas Esse @Pontifex_pt deveria se envergonhar e parar de envergonhar a Igreja Católica... Esse maldito lesou um país inteiro e o papa passando pano para o bandidão... Nojo! Por isso, estou cada vez mais afastada da Igreja... Vergonha!;1581613543000;5
@jaehxnisz ; tá bom jovem ateu da internet a gente já entendeu que a igreja é horrível, que você fica puto se alguém fala "vai com Deus" e que você não tem que seguir religião nenhuma ok? agora senta um pouquinho aqui e toma um copo de água;1581613537000;5
@Moreis05 ; @g_g_garci Derrota não sabem o porquê das pessoas estarem se afastando da igreja...;1581613502000;5
@amaliaguerra21 ; @Pontifex_pt Que vergonha esse encontro de hoje com um canalha que se aproxima da igreja apenas visando enganar os cristãos e roubar seus votos. Por essas que a igreja católica perde cada dia mais fiéis;1581613496000;5
@aureliosilvio ; @BlogdoNoblat Será se ele pede ao papa q se desfaça das fortunas da igreja e doe-os aos pobres. Ou, fará como Robin Hood, p não perder o vício.;1581613380000;5
@repardina ; @monikahartelt Tô dizendo, a igreja católica realmente é a grande prostituta da Terra, sempre se metendo com os piores, desde de sua fundação. Essa realmente não é a igreja de Cristo, me perdoem os irmãos católicos pq já fui uma também até que me LIBERTEI deste engodo.;1581613352000;5
@EduFerreira37 ; @Gnoturno2 Meu caro, não existiu na história da Igreja um Papa Piu! Talvez vc esteja se referindo a Pio, com 'O'. Todos que assumiram o nome Pio já morreram. O que temos hoje é o Francisco. Embora argentino, ele não é comunista.;1581613263000;5
@liberdade_ldr ; "SAI DESSE CORPO CAPETA!" kkkkkkkkkkkkkkSe você ainda ajuda a igreja com dízimo, viagem para Aparecida etc, PARE AGORA!Não sei quem Lula encarnou aí, se foi o Barrabás ou o bandido da cruz que não se arrependeu!Papa virou marmita de corrupto e ditador (vide Maduro) https://t.co/P8BUXH3Ewk;1581613136000;5
@CrlspaganelliJr ; @MozaAlexandre @LyLeonel @LulaOficial @gleisi O o primeiro papa da história que se propôs a reverter todo mal causado pela igreja no passado é o Papa Franscisco;1581613110000;5
@AlderVinicius ; @bernardopkuster A vivência da Igreja no coração de muitos está diminuindo drasticamente. Confesso que eu teria dificuldades em dar um sorriso se eu cumprimentasse o Lula, porém, penso que o dever maior do cristão são os dois mandamentos de cristo e zelar pela conversão das almas.;1581612928000;5
@whtevv ; ouvindo asking bem loca das ideia e uma tia vem me perguntar se tá longe da igreja santa luzia será deus me chamando ¿;1581612880000;5
@diego_lo2039 ; Lula quem perdoa é Deus é não o Papa  . O Papa é chefe da igreja católica.  Mas quem decide se as pessoas depois que morrem vão pro céu ou não é Deus;1581612736000;5
@petisquero ; @carlypgaiola Ela se benze pra agradecer pela graça. Assim com a gente faz quando passa na frente da igreja. Amém.;1581612704000;5
@aline_mtavares ; @Bruno_AlveSs @LulaOficial Justamente por ser católico, você deveria se alegrar por ver o maior líder da igreja católica seguir os preceitos de Cristo! Eu hein...;1581612580000;5
@flaviohcordeiro ; @bernardopkuster Complicado viu. Representante maior da igreja se deixando usar como capital político pra esse bandido condenado. E outra, como um cidadão que não pagou por seus crimes tem direito a passaporte e liberdade dessa forma!?!;1581612545000;5
@queel0111 ; eu falando da minha ansiedade que se agravou aí minha mãe vai e fala: ah isso é pq vc não tá indo pra igreja;1581612540000;5
@claudineijipa38 ; @LulaOficial olha o que virou religião , está certo que tudo é perdão, enquanto um se agarra na igreja tradicional o outro se agarra nos charlatões dinheristas, e segue o baile, hipocrisia pura , só acho que já passou da hora do falado julgamento final , as coisas estão sem limites até na fé.;1581612431000;5
@JulioCe02354066 ; @Diabacansada @QuebrandoOTabu Denuncia ou troca de igreja!, tem muita igreja boa ainda...Precisa da resposta da damares? Pessoas q se dizem de Deus mas não são  tbm tem na biblia! Não é de hj q o diaba ataca;1581612351000;5
@cynceramente ; @Eocharlinho @abrutaflor Se eu estou voltando cansada do trabalho e entra no meu vagão alguém gritando coisas que o pastor da igreja evangélica mandou no meu ouvido essa pessoa está com razão? Eu vou sair do lugar q tô sentada e foi uma luta pra conseguir por causa de uma crente sem noção? Não fode, né? https://t.co/t2KSvp0rzc;1581612235000;5
@zanattiinha ; Tinha uma menina do lado dele que discutiu com ele de xingar ele e tudo, e ela deu o exemplo dela que “vive” na igreja e não pensa assim(ele tbm vive na igreja). E eu amei ela ter se posicionado e mostrar que além da religião somos todos seres humanos.;1581612190000;5
@msantoxf ; se eu vejo a igreja da Penha eu sei que tô perto kkkk https://t.co/KVAQhcTtWY;1581612127000;5
@fredericomatts ; @padilhando Depois de tantos pecados, o mínimo que deveria fazer era tentar se aproximar de Deus mesmo. Ou pelo menos fingir isso (já que foi uma grande "coincidência" o PT perceber que precisava se aproximar dos fiéis da igreja e agora veio essa reunião).Enfim...;1581611842000;5
@Fabi37614053 ; @Pontifex_pt Que decepção. Se o comunismo tomar conta da igreja católica é o fim...;1581611766000;5
@NemEmUtopia ; @dontactstupid_ Sabe é um assunto delicado se for ligado a religião, entendo o lado da igreja mas tbm acho egoísta, é foda;1581611739000;5
@jeffcoelho_ ; Minha irma veste minha sobrinha de 8 anos como se fosse uma velha de 60 da igreja assembléia e ainda acha ruim qnd eu falo;1581611211000;5
@leonardo_stoppa ; Não vejo absurdo o Guedes pensar que a empregada doméstica não pode ir à Disney. Absurdo é grande parte das domésticas de hoje não se sentirem ofendidas com isso porque o pastor da igreja dela disse que Deus já está providenciando a bênção pra ela virar patroa...;1581611042000;5
@Letividi ; @Pontifex_pt Não é de vocês, não.Preocupe-se com as coisas da Igreja Católica que esta indo de mal a pior, o Fé em Cristo e seus ensinamentos, que estão deixando de lado, para se dedicarem a questões politicas e geralmente ligados a esquerda.Os católicos sentem-se abandonados pelo Vaticano.;1581610937000;5
@sonciare5988 ; @sycasy esses casos me lembram meu irmão 😔 que tbm foi assassinado e até hoje ngm descobriu (o q dizem) os autores e causas. ele nunca se envolveu com nada, era da igreja e estava saindo do trabalho qnd aconteceu. é horrível, sinto muito pela família pq sei bem como é a dor.;1581610850000;5
@kikiie ; Pena que tua mãe não te abortou né? Assim evitaria se tornar padre e manchar o nome da igreja/congregação. https://t.co/bdajdaCuFU;1581610674000;5
@ricardojgomes ; Os regimes comunistas são por natureza assassinos e escavizadores. Mataram muito mais do que o nazismo. Se alguém quiser conferir a crueldade cometida sobre trabalhadores, mulheres, membros da igreja e camponeses, sugiro a seguinte leitura: https://t.co/VbcZTRaZLt https://t.co/qZI1ukHMjU;1581610644000;5
@grazys0 ; @MaduSantosNunes @QuebrandoOTabu você vai me desculpar mas o fato da pessoa ser um ser humano podreee e que usa o nome de Deus para se aproveitar das pessoas, não tem nada haver com a igreja... As pessoas escolhem uma religião/crença com objetivo de adorar a Deus ou quem elas bem acharem que deve ser adorado;1581610577000;5
@macleud1 ; @Anna118650 Teu rato já está se escondendo em baixo da saia da igreja catróca.kkkkk Pra que tu quer Disney?!! Kkkk . Vai rezando aí.;1581610286000;5
@biano021CRF ; @leticiavelosole Santidade é uma palavra muito forte quando se trata da igreja...;1581610277000;5
@EManasses03 ; @gleisi Não sou católico, mas se fosse, sentiria muita vergonha de ter um Papa como este. Manchado a imagem da igreja católica.;1581610089000;5
@RafaelRamosS93 ; O candidato a prefeito de vocês deixou o PCdoB e resolveu se filiar ao partido do Marcelo Crivella e do Marcos Pereira bispo licenciado da Igreja Universal do Reino de Deus. Acho que o Bolsonarismo já tem o seu candidato a prefeitura de Slz. https://t.co/lEiXlJqHCk;1581610033000;5
@PauloRicardo_63 ; @barbosa2102 Ué? Comunistas são ateus e estão se agarrando ao líder da igreja católica para atacar Bolsonaro? É isso mesmo?;1581609903000;5
@Maryhel06807074 ; @Pontifex_pt A Amazônia é NOSSA !!! Primeiro cuide da sua casa que está se deteriorando a cada dia ! Igreja católica perdendo rebanhos e os escândalos de pedófila e corrupção.;1581609819000;5
