@akaleosin ; tive um sonho com o jacyr e kanye west lá na igreja batista de cosmópolis, a gente tava discutindo se o kanye poderia cantar umas músicas antes da pregação e o melhor, era tudo em português;1581504875000;5
@kemellylauana ; Conheceu o pai dela no caso, e ficaram 35 anos casados, o pai do 1° filhx, também se casou e cada um construiu sua família, viraram super amigos enfim, a esposa dele faleceu, um tempo depois o marido da mãe dela também, aí uns anos após os dois se encontraram em uma igreja;1581504739000;5
@BentoLucilia ; @o_antagonista F***da se. Nao estamos mais na idade media qdo a igreja tinha voz ativa. O q manda é a Justica, dos homens e divina. Este papa é um comuna deslavado e deve ser posto pra fora.;1581504337000;5
@jjacksonxavier ; @augustosnunes Desastre não somente para o Vaticano, mas também, para a vergonhosa justiça de nosso Brasil. Sinceramente, se esse descalabro acontecer, nosso País dá prova que não tem justiça e que a igreja Católica via o Papa Francisco, não está respeitando as leis de Deus...;1581504243000;5
@nanyhill ; Achei interessante a moça q publicou a história da "igreja imperialista" The send, porém não entendi o espanto de alguns comentadores. O q foi o colonialismo assentado tb na religião? Até o Weber falava da igreja e do protestantismo...daí se pergunta, qual o plano? Ñ tem plano;1581503872000;5
@CN_ ; Amigos dos animais (pelo que se sabe), anti-“old”-aristocracia, pela socialização e adversos à Igreja (eram no fundo pagãos new-age) e pró-eutanásia. E pela unidade da Europa... kind of rings a bell 😝 PS: ainda vou ser  banido daqui. https://t.co/ioKEoOT5ro;1581503687000;5
@talibmoussallem ; Que os bispos da vergonhosa @CNBBNacional se espelhem em D. Paprocki e deixem de lado a nojenta ideologia e política a que vem se pondo a serviço há anos.Tomem vergonha na cara e parem de humilhar a Santa Igreja no Brasil. Vocês não nos representam. https://t.co/ouTguBXdRs;1581502743000;5
@ribeirocatolico ; As pessoas jamais devem se afastar da verdade, sempre devemos lutar confiantes, defender a nossa alma do pecado e ter a certeza que a Santa Igreja é o caminho, pois ela vem de Cristo este que é o caminho, a verdade e a vida.;1581502668000;5
@_Crflory ; @ManoRamos2 @NoticiasdoRJ1 oq eu acho mais interessante que vc se diz crente e os caralho a 4, disse que ele poderia ta louvando a Deus, o seu escroto, vc louvando a Deus dentro da igreja e fora dela vc deseja infelicidade pro próximo  amado isso n é ser crente, vc é um babaca que n sabe oq diz;1581501411000;5
@lievmin ; rapaz ela falando um monte toda noite da irmã da igreja e da pastora tudo coisa ruim e depois dizendo que elas vieram com um papinho de que existia pessoas fofoqueiras e falsos no ministério lá e ela "nunca falei nada delas quero vê se estiverem falando de mim" KKKKKKKKJJ;1581500392000;5
@nersoneto ; Você fuma maconha? Se converta!Você é gay? Práticas demoníacas!Não concorda com algo que sua "liderança espiritual" diz? É rebelde!Não apoia candidatos políticos evangélicos?  Traidor!Esse pensamento te tira da igreja e te coloca em um clube onde o amor sempre fica no 2°plano;1581499487000;5
@qissoegler ; O primeiro eu nem lembro mais, só sei que goi horrível e o segundo é sobre dois irmãos que estão brincando no pátio de uma igreja enquanto os pais estão numa reunião, aí ele grita pra ela que o carrinho dele passou por debaixo da porta e ela abre pra ver se tem como pegar;1581497325000;5
@Carpitalista_ ; @Mario_99999 @izzynobre Pq metade da igreja católica, assim como diversos pastores evangélicos, são maçons. (Embora a maçonaria seja excomungada da Santa igreja, se n me engano);1581497058000;5
@JulioJipSk ; @xicograziano O papa rediscutindo estratégias de “campeões nacionais “ gerados com uso de dinheiro público pra se transformarem em campeões globais e haver alguns super ricos e muito menos ricos pra facilitar negociações da igreja?;1581495084000;5
@_evanszs ; se deus existe,não importa se você vai pra igreja ou não,ele ta perto de ti da mesma forma e intensidade;1581491473000;5
@Soljentsin1 ; @bernardopkuster Bernardo, porque a igreja católica difere tanto da católica ortodoxa, sou leigo no assunto, mas esta, parece ter se preservado mais, aparenta ser "mais sacra", ainda existem igrejas católicas romanas assim, "mais tradicionais" aqui no Brasil?https://t.co/zr0kyB1tpb;1581490773000;5
@SurtadaDuda22 ; Amanhã se eu sair cedo da escola vou pra igreja 🙏💕;1581486019000;5
@DanDanriel ; @marjoriecalixto igreja, eu era bem inocente e não tinha noção nenhuma disso, ai fui la com ele pra não apanhar da minha mãe é óbvio e foi quando ele me mandou obedecer tudo q ele falasse e me mandou abaixar as calças e o resto vc ja sabe, como foi no seco sem porra nenhuma como se estupro fosse+;1581485299000;5
@diananamartinxx ; Me ofereceu um vinho, e eu falei baixinho "c se esqueceu que eu sou crente?" FALA SÉRIO EU SOU DA IGREJANão bebo vinho e nem cerveja;1581485048000;5
@starryscenery_ ; @r_juniior87 @QuebrandoOTabu A mãe da minha amiga da igreja sofreu violência doméstica por anos, minha amiga perguntou ao pastor se tinha a possibilidade da mãe dela se divorciar por causa disso e ele respondeu que nãoSe ele disse q n podia divorciar imagina oq diria sobre denunciar;1581484648000;5
@_Crflory ; @ManoRamos2 @NoticiasdoRJ1 vc caso sabe se ele estava trabalhando ou algo do tipo,até dentro da igreja corremos o risco de ser baleado, e se caso ele esteja com um tornozeleira, isso n que dizer q ele seja a msm pessoa de antes, todo mundo tem a oportunidade de mudar, então n é pq ele n estava;1581483540000;5
@Robertasnts2 ; vou p acampamento da igreja, vou orar tantooo, vou aproveitar tanto todos os momentosss.....vai ser o 2º acampamento de mts se Deus quiser 🥰;1581482724000;5
@korage_rhuan ; 😺✏ — Sentar só se for no banco da igreja pra orar https://t.co/CIYwKzGhFV;1581482468000;5
@ILucaszHyro ; Se esse cara fizer isso eu me caso com ele. E também abro a igreja do culto aos Deuses Astecas da Maromba, que por acaso seria uma academia e eu mesmo viraria um maromba https://t.co/9K1Q8Z8xOm;1581482331000;5
@BeatrizReiiis ; Minha mãe pegou trauma de bbb pq ela amava o Jean aí depois como deputado aqueles vídeos falando mal da igreja etc ela se sente super traída kkk https://t.co/ZWqfEVhTPJ;1581482292000;5
@andrade_negrr ; Eu tenho que lembrar que eu vou fazer isso "pra Deus" se não eu num passo nem perto daquela igreja amanhã cedo .. o que me incomoda nisso tudo é só o tamanho da folga desse povo ..;1581482071000;5
@queissoloris_ ; se fosse pra assistir cidade dorme eu deixava as câmeras 24 horas no acampamento da igreja;1581481670000;5
@ttdaThassi ; minha mae me perguntando qm era o gusta e se ele eh da igreja 😂😂😂😂;1581481652000;5
@Senhorita_L ; Se nada der certo, vou vender amendoim na porta da igreja, quando o padre falar Amém, eu vou gritar: Doim!;1581481628000;5
@lacorteb_ ; @AleYazbeck Vc que não se dá o respeito. Eu vou na igreja todo domingo;1581481132000;5
@caraidanii ; Lembrei da minha coordenadora insinuando que eu não tinha namorado por que ia em balada ao invés se ir na igreja, fiquei triste;1581480703000;5
@victorestrela69 ; A mulher da igreja me falou uma coisa tão linda que meu coração se encheu de alegria.;1581479703000;5
@LaisaSS ; No terminal sempre tem um senhor que fica gritando no pé do ouvido da gente. Vai pregar na sua igreja, para de gritar no ouvido dos outros.E o povo ainda fica "é bom, ele tá com a palavra."Vontade de chamar uma galera do candomblé e ir fazer o mesmo pra ver se alguém reclama https://t.co/ceFoPyv9e9;1581479233000;5
@antiqueersto ; um filho da puta abandonou a cachorra enquanto ela tava parindoagora ele se fodeu porque estão expondo as redes sociais, a empresa, a igreja que ele frequenta, o telefone... eu sou a pessoa mais paciente do mundo mas quem maltrata bicho merece sofrer das piores formas possíveis;1581478869000;5
@ArrudaJGabriel ; @franciscorazzo @femoricastro A princípio pode se pensar que ambos estão pensando a respeito do mesmo fato mas não.Dráuzio fala de como as pessoas que vivem a sexualidade secular poderiam se previnir de consequências da prática dela, já a igreja de como a sexualidade deveria ser vivida de forma plena.;1581478583000;5
@vjencgx ; @itsannalu sim! tipo minha mãe que me obrigava a ir pra igreja, mesmo eu querendo ficar em casa. ela dizia que se eu não fosse, também não ia ficar com o celular em casa, que iria guardar e só me entregar quando voltasse. por esses motivo nunca gostei da Igreja, só ia por obrigação.;1581478539000;5
@feitoporhnrq ; @sdesarahh O que fala que os fofoqueiros não entrarão no céu. Meu da um conforto, UMA PAZ, saber que 70% dos cristãos na minha ex igreja vão junto comigo se existir inferno kkk;1581478392000;5
@GuiLucio15 ; @Gabigazin A Igreja diz a mesma coisa faz dois mil anos e o que ela diz é: Fora da Igreja não há salvação. Se converta, pare de ir nos hereges protestantes e pare de achar que seu achismo é o certo, pq o inferno é logo ali. Jesus te ama 😘;1581478387000;5
@RennanCPonte ; Por isso q eu acredito na Igreja Católica, a hierarquia exige anos de estudos e os entendimentos são colegiados, já esses caras decidem pregar a palavra da forma como entendem como se fossem Papas só que sem os anos de estudos e a sabedoria;1581477995000;5
@markmywrIds ; eu ja falei com a menina da minha igreja sobre ele e ela disse que eu tenho esperar pq se ele quiser ele vai vir atras MAS EU SOU ANSIOSA AAAAAA;1581477697000;5
@RenatoJuvino ; Ninguém sai da igreja de uma vez, de uma hora pra outra. Ninguém. A pessoa vai se envolvendo com o mundo aos poucos. Às vezes de forma impercetível. Às vezes de forma intencional. Mas sempre assim, nessa sutileza. Vejo isso acontecendo diante dos meus olhos o tempo todo.;1581477468000;5
@aestefanimacena ; A vida cristã não se limita a ficar 2h num culto. Não adianta ir em todos os cultos da sua igreja, mas em casa, no trabalho, na escola agir com indiferença com o seu próximo.;1581477263000;5
@callie_se ; A GENTE VAI PARA O INFERNO CANTANDO MÚSICA DA IGREJA KLLKKKKKKKKK https://t.co/RdHumde1MV;1581477038000;5
@johnnykatayama ; @anabahstos Se os dois linguarudos da casa de vido não tivessem entrado até agora o pessoal ia tá pensando que a Marcela era louca surtada.Aí os caras que passaram a semana debochando da situação pedem desculpas e blz.... Mais fácil que confessar pro padre na igreja!;1581477023000;5
@whosandressa ; que inferno de criança o neto da minha vizinha que se acha um mini pastor e fica berrando essa hora da noite vai pra igreja;1581476869000;5
@tamiris_flukye ; O que faz a gente se sentir velha mesmo é ver que as crianças da época da igreja já estão namorando, casando, tendo filhos etc. Çocorru 😬;1581476629000;5
@beatressee ; Eu namorei um rapaz, namorico de 1 ano quase, em 2012... vira e mexe ele aparecia na minha vida, mas a gente n se batia mais pq ele era da igreja e tals,  agora o cara voltou desandadao querendo me topar kalkakakka. Engraçado como as coisas são, a gente sempre manteve contato pq+;1581476444000;5
@Fabiououo ; @felipeprior Só espero que não se junte com a gelera da igreja lá, por favor.;1581476059000;5
@Naty_27silva ; se sua família é da igreja você vai entender esse twitte https://t.co/hn0WCKyz9Z;1581475758000;5
@Viajantesdmundo ; @apropriajuliana @__PogChamp @GeraldodeRivio @flaviademaria_ Sim possuí sim até pq o Sisma da igreja católica que se deu no começo da idade média foi um março histórico e tbm cultural. E de forma clerical tbm;1581475719000;5
@Rayanee_marcoli ; Se fosse eu cantando um ponto de umbanda DÚVIDO que não vinham umas 15 veia e uns 10 cara da igreja me xingar DÚVIDOHipocrisia é mato no mundo glr https://t.co/9uUTaaSmOC;1581475547000;5
@sickpierre ; sempre há tempo de se arrepender, confessar e trilhar os caminhos do justo, existem diversos santos como exemplo.Santo Agostinho foi um maniqueu boêmio antes de se tornar um doutor santo da igreja de Cristo;1581475313000;5
@ngiemars ; Eu desejo a vcs a amizade que eu tenho com meu namorado. Parece que perto ela só se multiplicou junto com a cumplicidade e só queria desabafar que tá muito bom. Depois da igreja e de mãe, ele é meu ponto de paz mais gostoso. @spkjim obrigada por tudo. Você é meu anjinho. 🌻;1581475030000;5
@_morceguin ; @srh013_ Onda da igreja né Sarah só se for;1581474791000;5
@taldabaile ; Hoje ouvi uma história da kenia e é muito triste saber que a igreja realmente manipula não a igreja em si mas sim as pessoas e meu eu me identifiquei tanto que tem tanta parada errada que se a gente apontar os erros as pessoas da bolha nós trazem um cancelamento.;1581474496000;5
@OtavioPadeti ; As vezes a gente faz piada com os de dentro da igreja como se isso não fosse aparecer no julgamento final. Vc tá suave q vai subir, irmãozão? Da uma repensada rs https://t.co/5pEQqGGYrt;1581474305000;5
@Rafacapial ; Se tem um lugar difícil de lidar com o serumaninhos é dentro da igreja. PQP. Deveria ser ao contrário. ...O evangelho tá mesmo é nas rua brow 🤟🏽;1581474227000;5
@ViniGal2 ; @loopesdiass Puts, esperava mais da sua interpretação amiga, de fato não vejo isso nela e respeito sua opinião por enxergar isso. Eu não sinto verdade, acho maquiavel e insuportável ver ela usando a igreja para pregar de boa moça (como se a religião evangélica fosse dos certinhos) +;1581474203000;5
@ally_som ; Um conselho que recebi a um tempo e sempre gosto de passar é: nunca deixe de servir a Deus na forma que for, por exemplo, muitas pessoas que vejo se afastando de Deus e até da igreja foi porque deixou de fazer a obra dEle e se deixou sair do primeiro amor...;1581474152000;5
@marianelepletie ; Deus tem que honrrar muito a igreja da pastora Patrícia que igreja maravilhosa aonde Deus fala tremendamente naquele lugar por isso que todo mês sou dizimista pra ajudar a nunca fechar aquelas portas, é dando que se recebe 🙏🏿;1581474101000;5
@hannibkl ; os meninos da juventude da igreja sempre foram seletivos com as meninas com quem seriam simpáticos, e geralmente são as meninas bonitas, vi isso impedir que muitas delas crescessem porque se envolviam com meninos imaturos na fé;1581473957000;5
@amandacdc20 ; se até meus amigos da igreja me excluem quem dirá os amigos de fora...;1581473829000;5
@JP_Siqueira1 ; @_caastrooo 2) O próprio Catecismo da Igreja, chama os irmãos evangélicos de Cristãos (CIC 818)E mais uma vez, não cabe a nós dizer quem é cristão ou não!Porquê não basta "se dizer cristão", é preciso viver como Cristo viveu. E não somos nós que realizamos esse julgamento.;1581473803000;5
@amandam1796 ; adoro o fato da minha mãe sempre se contradizer e ter sempre algo pra reclamar de mim. Se eu to quieta demais eu to distante e to diferente, se eu saio eu tenho força pra sair com as amigas mas pra ir na igreja não.;1581473772000;5
@Ale17almeida ; @BragaL0ures Qual igreja vc vai? Eu frequento uma e na igreja quem julga se é errado ou não, é cada membro da igreja (adulto,  livre e consciente).  Na escola, que escolha ou julgamento pode vir de uma criança?Qual foi a parte que não entenderam, na relação aldultos x crianças?;1581473598000;5
@escorpiAnaClara ; impressionante, quando eu me “afasto” da igreja e decido voltar, tenho a sensação de que era oq tava faltando e que sempre vem na hora certa. Não se descrever a sensação, mas realmente Deus completa tudo;1581473576000;5
@98GGUK ; @filhodomau @MaduSantosNunes @Be3eto @itsannalu na idade média uma mulher que sofria estupro era acusada de adulterio e torturada pela igreja católica, cala a merda da sua boca se vc nao entende de porra nenhuma do que esta falando;1581473473000;5
@presentededeuss ; Gente se o Bolsonaro é crente imagina a igreja q recebe o dízimo deleSerá q é o dízimo dos impostos pq se for da pra converter o dízimo dele em ação social sjsjsjsjsjsjsjsjsj;1581473452000;5
@BBBComenta2020 ; opora virou igreja da redenção? tava todo mundo se odiando até ontem #BBB20;1581473298000;5
@Jorg3fjr ; @alex_4am @g1 Se vc tiver dentro da igreja eu apoio 👍;1581473227000;5
@baianaretada69 ; O broder que fica vai querer se batizar na igreja da Rafa.;1581473173000;5
@rafcavalheiro ; Se a Rafa me der um panfleto da igreja na rua acho que eu até finjo ler #bbb20;1581473084000;5
@Let_Abreu16 ; calendário da escola ou o da videira já podem se decidir em quem vai mudar as datas, não tô preparada p fazer provas nos dias de eventos na igreja;1581473010000;5
@0tawany ; hj eu ouvindo musica na van ai td mundo olja p mim ai a garota da minha sala fala: ele ta falando com você!!!! ai eu: que que foi!?!??!?!?!?! o moto tava perguntando se eu era de alguma igreja kkkkkk;1581472912000;5
@jrtvilanova ; @caioblinder Caio, só não entendo a sua surpresa, o modus operandi do governo e de grande parte dos apoiadores tem sido lastreados pela mentira. Não se trata de esquerda nem direita, trata-se da exibição diária do que há de pior no ser humano baseado sob a falsa tríade Brasil,família e igreja;1581472896000;5
@Natiellyaraujo_ ; Minha mãe é muito do "sou da igreja não posso brigar" e aí eles ficam se espichando nela, eles que não me tirem pra louca pq eu não sou da igreja e não levo pra casa desaforo de gente mal amada;1581472818000;5
@MarcianoBrito13 ; A maioria dos brasileiros, especialmente os mais jovens, acessam noticiário fakenews de bolsonaro pelas redes WWW/TV da Igreja/Globo.Por este motivo, quando eu pergunto aos minions se eles conhecem o projeto tal ou medida provisória tal tomada pelo gov. bozo, eles desconhecem.. https://t.co/zRFihuhrQu;1581472783000;5
@julinha_rosaa ; muito engraçado... você sai da igreja e a pessoa para de te seguir, ai que lindo, deve se contaminar só porque to no “mundo” como dizem kk auge;1581472618000;5
@epatrocinio1 ; @o_antagonista @LulaOficial Eles se merecem!! Que Papa mais sem moral da história da igreja católica. Vergonhoso receber um ladrão de carteirinha;1581472380000;5
@seila7k ; [21:50, 11/02/2020] Ema Nu Eli❤️: lek[21:50, 11/02/2020] Ema Nu Eli❤️: acabei de sair da igreja[21:50, 11/02/2020] Ema Nu Eli❤️: e já quero beber[21:51, 11/02/2020] Lupinto: KKKKKKKKKKKKKKKK VAI SE FODE EMANUELI[21:51, 11/02/2020] Lupinto: ASKNDJSDD;1581472337000;5
@jaxxmim ; vi uma menina igual a mim num vídeo da igreja que cheguei até a me perguntar se eu fui pra igreja hoje;1581472323000;5
@porobaron ; @storm_alv @itsannalu Sim eu ficava pura de ódio com uma vontade de brigar com os caras. Mas onde eu moro as pessoas sao muito religiosa no ponto q vc n pode ir nem pedir pra baixa som da igreja. Ai eu tinha que fica na minha Pq se n a exculhambada era eu;1581472281000;5
@byell_araujo ; Fala q e crente q tem fé em Deus faz td certinho e por isso tem vaga garantida no céu, mas fala mal da irmã da igreja, do famíliar lgbt, fofoca da vida de td mundo e se falar q Deus e preto surta... Fazer Oq né;1581472258000;5
@thatspokes ; A missao de “salvar” o outro espiritualmente é so uma cruzada moral, alem de q o cristianismo zero se preocupa c a salvação fisica de qm corre perigo e passa fome. Se se preocupasse a postura politica da igreja seria outra https://t.co/VONoDYM7k5;1581472233000;5
@Amandkrc ; [11/2 22:14] : Essa foto no banheiro é na igreja? Kk parece o banheiro da minha igreja.[11/2 22:18] Amanda: Não é não, mas posso tirar uma lá, se vc me convidar rsPerdoa papai do céu 🙏🏻😂;1581472145000;5
@Pastorinho4 ; @murilo_moraes9 Vai se fude obreira da igreja;1581472038000;5
@NiBron_ ; @AdryenneDornel1 @itsannalu Quem faz isso é da mesma comunidade, frequentam a mesma igreja, tem a mesma crença e eu não vejo eles se opondo a isso, se não acham correto por que os próprios não propõe essa autocrítica em suas igrejas? Porque evangélico raramente ouve gente de fora do clube.;1581471673000;5
@da_cia ; Num mesmo dia, 2 testemunhos alardeados pela imprensa como prova se esfarelaram completamente. Totalmente sem critério a imprensa-BR, tem q fechar tudo e virar igreja mesmo;1581471588000;5
@villiansoares ; "Se você devotar (...) à leitura de nossas palavras, então, inequivocadamente, reconhecerá que essa mesmíssima doutrina por meio da qual (os católicos) reivindicam ser a Igreja, não passa de um açougue mortal das almas, um tição, uma ruína e a destruição da Igreja";1581471327000;5
@GabsPimentel_4 ; @gandalfsmelon Enorme atraso na ciência, Putz grila! Da para entender que se a Igreja não existir teríamos carros voadores hoje em dia, teletransportes, ciborgues. Estaríamos num Star Wars da vida;1581470873000;5
@marscianaa ; @rantejedor @_duda_sousa @ClariceBean19 @AdryenneDornel1 @itsannalu Aqui do lado de casa tem yma igreja e eles ficam com volume no maximo papo de 7 hrs da manhã, de noite tbm Ate que chegou um cara e colocou o carro dele do lado com som muito alto e o pastor foi reclamar, nao era nem 10 horas da noite ai ele se fudeuEles podem e a gente n?;1581470805000;5
@_caastrooo ; @JP_Siqueira1 E por fim, o verdadeiro ecumenismo, com os que estão no erro, é mostrar-lhes a Verdade, e rezar por eles – não “com” eles – para que se convertam à verdadeira fé, tal e como rezava toda a santa Igreja na sagrada liturgia da Sexta-feira Santa: +;1581470699000;5
@_caastrooo ; @JP_Siqueira1 E o IV Concílio de Latrão proclamou o seguinte dogma:"E uma só é a Igreja universal dos fiéis, fora da qual ninguém absolutamente se salva". (cfr. Denzinger, 430);1581470618000;5
@Guifeijao009 ; Alguém me explica esses filósofos brasileiro que se dizem ateus mais usam frases de santo da igreja católica;1581470355000;5
@luisa_rubbin ; @PaoComBanana1 @luhh_gomezz @vivi04682139 se vai encontrar seus amigo da igreja né;1581470252000;5
@padeiropopular ; @JolydiKujo queria mamar, mas ainda vou ter problemas com fornicação por causa das igreja da familis, imagina se mamar macho então 😐;1581470230000;5
@andrade_negrr ; A minha amizade com Índia foi uma das melhores coisas dos últimos tempos além da gnt ter intimidade pra cv's sobre tudo e a gnt se conhecer a tempo dms. Um tava sempre puxando o outro pra igreja,foi uma das pessoas que mais incentivou minha fé nos entendemos dms;1581469939000;5
@bero2correia ; Imagina quanto pediriam se já tivessem assistido a algum episódio de South Park... 😂😁🤣A Igreja Pentecostal Brasa Viva ajuizou ação na qual pede a condenação da Netflix e do Porta dos Fundos ao pagamento de indenização de R$ 1 bilhão por danos morais.https://t.co/DiGOG06cxl https://t.co/9N8NOFD31o;1581469903000;5
@marcellasanto1 ; Minha tia tinha feito uma promessa q se eu passasse agt ia andar de joelho até o altar da igreja de nossa senhora do perpétuo socorro.... promessa é dívida cumprida! Esse dia chegou e foi tão especial;1581469862000;5
@TradioCatlica1 ; @A_Paz_de_Cristo @centrodombosco Concordo plenamente com isso e mais: espero que o candidato que se declara Católico tenha como princípio no congresso a defesa da Doutrina Social da Igreja — que saia da dicotomia esquerda x direita que predomina no Brasil.;1581469717000;5
@greatthorn ; Sobre a parte da propagação da aids ele está parcialmente correto. A igreja se baseou em encíclicas que defendem até hoje sobre a concepção não pode ser impedida de forma alguma (humanae vitae). A outra era a suposta ligação da AIDS com a vida promíscua (no caso lgbt) +;1581469440000;5
@anabiabarros_ ; se exponha:- sua tela de bloqueio- seu plano de fundo- última música que escutou- décima foto da galeria (ministério da mídia da igreja sempre presente comigo em todos os momentos kkkkkkkk, pensei que seria uma foto da minha gata e na vdd é a arte de um culto, oh mídia...) https://t.co/W1SQMgX2Y2 https://t.co/3K1mWvpd5h;1581469416000;5
@GravinaEduardo ; Bolsonaro, super religioso, Chefe de Estado, se encontrou qnts vezes com o líder da igreja dele? Pois é. Nenhuma. https://t.co/JuNv05ZqXD;1581469365000;5
@maiseSilva7 ; @emillyzimbicki Amiga só consigo lembrar de vc se apaixonar, no menino da igreja kkkkkkkkkkk;1581469284000;5
@ewellyn_rayssa ; Amo ver o ministério das meninas da minha igreja se desenvolvendo, ganhando nosso espaço como futuras ministras. 💖😭;1581469224000;5
@evelinbianca ; A mãe indignada porque tão dizendo na igreja do Areal que "oS filhoS do Breno tão fora da igreja". Eu acho engraçado que ninguém se interessa em saber porque eu não vou mais lá, se eu vou em outro lugar, se eu tô bem.;1581468593000;5
@HProtestante ; @blogsdareforma @_CulturadoReino  Assim como ocorreu no Brasil o restante da América do Sul permaneceu um celeiro exclusivo da Igreja Católica Romana. Uma presença protestante foi se esboçando de forma muito tímida, ... https://t.co/Ff57bb5YPQ https://t.co/QKkbJSvW4R;1581468301000;5
@paozinhx ; Engraçado que esses meus princípios e etc, tudo que eu sou e acredito, eu sinto que adquiri exatamente por ter crescido dentro da igreja, mas não entendo o por quê da instituição não refletir o que me foi ensinado, se foi lá dentro que eu aprendi;1581468291000;5
@HProtestante ; @blogsdareforma @_CulturadoReino  Assim como ocorreu no Brasil o restante da América do Sul permaneceu um celeiro exclusivo da Igreja Católica Romana. Uma presença protestante foi se esboçando de forma muito tímida, ... https://t.co/Ff57bb5YPQ https://t.co/iAnSIjBD7W;1581468233000;5
@choracuica ; baixou jesus na irmã da igreja e falou DOUTOR AUZIO DEUS TÁ DIZENDO QUE É PRA VOCÊ SE CANDIDATARo problema é que ela falou em línguas e ninguém entendeu;1581468059000;5
