@miquelanecalhau ; @mudmalfy Passei um período afastada da igreja, ia em alguns rolês com meus amigos e nunca bebi. Sempre fui a sóbria do rolê. Nunca bebi e sempre era a que mais se divertia, sempre com uma garrafa de água na mão. Os amigos sempre perguntavam: como vc consegue se divertir sem beber? (+);1581348202000;5
@thais_novaiss ; @HenriKairo @ladama___ @brunori8s @ocarlosantos @_S_Ricardo Conheço ss,  e muito bem minha igreja, aliás, minha igreja ñ bate de porta em porta 8h da manhã na casa de ngm, isso é costume de outra congregação, mas msm assim, se eles batem, é pelo oq eles acreditam, já vieram na minha casa também, e ngm me obrigou a seguir oq eles acreditam;1581348193000;5
@naomermao5 ; Tava aqui pensando q não importa o lugar , se tem tu e um amigo da igreja o assunto é SEMPRE o mesmo . Aconteceu no bloquinho, acontece no bar, acontece em todooooo lugar .;1581348010000;5
@_bragajean ; @Na_Igreja A raiz do avivamento é o ARREPENDIMENTO. Se não houve mudança de vida, abandono de pecado, mudança de mente, então não houve avivamento. Houve apenas um momento de êxtase emocional, e depois dali a vida da pessoa continua a mesma coisa.;1581347830000;5
@wellingtonsoulz ; @Na_Igreja Se estará nos próximos encontros de oração com os irmãos da sua comunidade e nos cultos de ensinos;1581347686000;5
@KledsomC ; @g1 É visivelmente um monstro ela destruiu o que se têm de mais precioso no mundo à familia da gente. A pergunta que mais doe é saber, porque deixar um ser insignificante vivo assim. Pra depois de algum tempo dizer que está arrependida e olhe lá, ir em uma igreja e bancar a pastora.;1581347575000;5
@Impostos_ricos ; O Brasil tem um Tabu de falar da renda dos ricos.Não sei se esse tabu foi criado pela Globo ou pela igrejaO fato é que se o país não cresce, e a renda dos ricos sim, então os pobres estão perdendoIsso é ter consciência de classe, os ricos tem e os pobres tem que ter;1581347551000;5
@VicGzOu ; @muller_vermella @calqueraun Entre o que desviam à privada e o que desviam à Igreja...Se fosse católico e tivesse catarro, diria aquilo de "Deus nos pilhe confessados"Como nem umha nem outra... "A culpa é do bipartito"?😒#FakeHó, grande gestor... da carteira das suas amizades!;1581347047000;5
@prissguerrero1 ; Que se lasque a igreja alagada em Taboão da Serra! Igreja não paga Imposto de nada e se bobear ainda faz gato de água e luz! Foca no povo que perdeu as coisas, repórter do SPTV!;1581346834000;5
@niksuzinhu ; Mano eu tinha esquecido de bloquear a tia da igreja dos stts pqp, se ela comentar alguma coisa cmg, vou dizer q foi hack ou vírus;1581346806000;5
@HenriKairo ; @ocarlosantos @Sxnnic @ladama___ @brunori8s @_S_Ricardo Todo mundo q ta fora da igreja tem o entendimento distorcido, mas a galera q vcs dão poder não tem, né? Eu conheço a biblia e tudo q envolve a igreja de vcs. Repetindo: Se vcs não gostam da fama da igreja, coloquem seres humanos em destaque e não monstros.;1581346680000;5
@giiofernandes_ ; @Na_Igreja puts, eu estava conversando com o meu amigo isso dia 6, sobre as pessoas se levarem pela emoção da unção de quem está do lado;1581346474000;5
@Conexaotv_01 ; @Jackson76257281 @Jonas92414101 @SiteCTV Isso seria a msm coisa. Meu querido vc sabe q a Universal paga uns 600 milhões ou mais pelas madrugadas da Record né? Se hj ela ñ está falida é por causa da igreja, então vc deveria agradecer.;1581346342000;5
@JurgenSpies ; @lipeleocarvalho @leandroruschel Não se constrói doutrina baseado em um único trecho bíblico. Ainda assim desconhece o original em grego. "Petrus" significa pedregulho, ou fragmento de pedra, ou derivado da pedra. Segundo Agostinho e desde  a Igreja primitiva, a Pedra a que se refere o texto é o próprio Cristo..;1581346245000;5
@MarcioACalixto ; @MarcosQuezado1 Tomara que o ladrão tente pegar na mão do anticristo para levar uns tapa.  É lembrando, de novo a história se repete, o ladrão ganhado a preferência da igreja (os fortes entenderão).;1581345567000;5
@Elivelt32799970 ; @rodrigofee2 Normal vc se afastou da igreja é conhecedor da palavra de Deus e sabe q sua felicidade só Cristo pode te dar não estou aqui pra dar lição de moral e nem nada do tipo porem Rodrigo vc sabe e conhece bem a bíblia e sabe muito bem oq vc deve fazer eu ainda vejo pregação sua;1581345427000;5
@anarcokev ; Sinto mt se a sogra de vcs n gosta de vcs, pq a minha comprou pupunha, pão, banana, tucumã e ainda colocou meu cafezinho no copo e ficou fofocando comigo sobre a irmã da igreja que come q nem o cão.;1581345325000;5
@aqui_naokk ; Felipe Neto parece meu pai ou qualquer tiozinho de igreja kkkkkk na minha idade formava quadrilha, traficava, caía por receptação e a porra toda. Aí fica velho e vira moralista pra caralho, se achando o ápice da santidade. Chato chato y chato;1581345260000;5
@aline991211 ; A Bíblia profetiza sobre o último dia do julgamento.Então, no dia do ultimo julgamento, que tipo de pessoas serão salvas?AhnSahnghong e o Rei Davi : A Igreja de Deus onde se guardam a Páscoa da Nova ... https://t.co/C3oPmHvdNc;1581345034000;5
@saravianagv ; a pessoa diz que subiria a aparecida de joelhos se conseguisse um beijinho meu.. eu dou e a pessoa não vai nem até a igreja da esquina agradecer acender uma vela, tá de sacanagem;1581345032000;5
@marinascr__ ; minha teoria de que o pessoal da igreja eh o pior que existe e o que menos sao santos só se confirma mais a cada dia que se passa;1581344833000;5
@emma631947 ; +história mas eu acho bonito Eu: ah... Ela: ...Ela: sabe o ano de 2020 é o melhor pra se assumir pros paisEu: pq?Ela: pq pd dizer: o ano é bi e eu tbm sou kkkkEu: vdd kkkk(Esse diálogo todo no meio da igreja) Minha cabeça: ela desconfia de mim? Bem se ela quisesse saber+;1581344817000;5
@HenriKairo ; @thais_novaiss @ladama___ @brunori8s @ocarlosantos @_S_Ricardo A grande maioria é sim. Não é a toa q vcs tão la em Brasilia querendo obrigar as pessoas a seguirem seus preceitos. Se alinhem com pessoas boas e não com homicidas em potêncial q a visão da igreja talvez melhore. Parem de obrigar as pessoas a seguirem suas crenças!;1581344697000;5
@jootaelee ; Enquanto a visão da Igreja for para o HOMEM e não para o SOBRENATURAL de DEUS (já provado na BÍBLIA). As ESCAMAS não vão CAIR, vão se achar os mais TEÓLOGOS e vão achar que 150 mil pessoas em 3 ESTÁDIOS foi NADA DE MAIS! #seliguem;1581344689000;5
@mareadss ; A pessoa se diz da igreja, prega amor ao próximo e blá-blá-blá e faz a vida do outro um inferno, hipocrisia que fala né?;1581344557000;5
@tagoremartins ; @Maierzinha Se ele não ouvir, vale a pena apresentar a alguma liderança da igreja. A partir daí, é entrega a comunidade. Talvez seja necessário um acompanhamento contínuo: recomendaria um homem maduro que orientasse esse irmão.;1581343645000;5
@jlevicrf ; @felix_gfb No meu caso isso teve um lado bomSe não tivesse sido assim certamente durante algum momento da minha adolescência eu teria me enfiado em alguma igreja evangélica e estaria até hoje batendo palma pras merdas que são faladas nesse meio Mas sim, na maior parte dos casos é perigoso;1581343406000;5
@ferreirajrrrr ; @pbianch_ Simmmmmmmm. Eu comecei a ficar menos desesperado e triste em relação a isso quando eu entendi que eu já tinha feito tudo que poderia fazer, e agr era apenas minhas orações. Mas nosso coração se fere com essas "perdas", não só dá igreja mas da minha vida tb pq;1581343091000;5
@hugscyz ; eu acho isso muito da hora, pq cada um é de uma igreja, cada um é de uma denominação, deve ter gente nessa rodoviária de várias cidades diferentes, que nunca nem se viram e se unem na canção como família que são 💛 https://t.co/Ce94dVdqmK;1581342977000;5
@johnsantanna ; Estamos no século 21 e a igreja ainda consegue obrigar as pessoas a "seguirem regras" e "se adequarem" aos seus conceitos deturpados da salvação e do amor de Cristo. Sinceramente, viu;1581342867000;5
@ZeSantinhoo ; ---Eu ontem ... Lucas já já rael aparece Aki tu vai ver só kkkk dito e feito, o cara n sabe se da igreja ou macumbeiro;1581342441000;5
@Orlando_il ; @tavasconcellos Eu sendo Cristão evangélico, tenho vergonha de ver tantos irmãos da igreja apoiando este homem.Não só os crentes, amigos estudados, engenheiros, empresários.E a imprensa, parece que não sabem se é pior o governo cair ou verem a nossa destruição.Parece um vírus ou feitiço.;1581342276000;5
@felipeabreu_l ; ano passado eu vi um bloco de carnaval evangélico na barra da tijuca, traguei o paiero 3x pra ver se não tava tendo ilusão e naquele momento eu me senti na escolha certa de ter se afastado de qualquer igreja;1581341482000;5
@Karolainee0 ; @__jandir @oliveiraviiic Pq quando se conhece e gosta das coisas de fora da igreja, para voltar tu fica pensando que terá que abandonar tudo (realmente) mas também é foda lembrar que as coisas de Deus são maiores e melhores que qualquer diversão do mundo;1581341420000;5
@accioperalta ; @Iostbridgerton que nada amiga, eu só sei reconhecer os erros da igreja em muitas coisasmas a que eu frequento sempre fala sobre sermos chacotas no mundo porque a quantidade de crente falso é gigante, igreja se vendendo a política, políticos, quando se devem apenas seguir Deus e a bondade dele;1581341012000;5
@_sarahassis ; @gabimendescrf gabriela plmds se controla vc é da igreja pra qq tu quer saber onde ele mora sua safada;1581340984000;5
@PauloValrio ; Pelo contato a que se expôs e pelos riscos envolvidos você também ficará em quarentena .Só sairá se todos saírem juntos e saudáveis.Quem é você?É um político?  É da OAB? Dos Direitos humanos? É de alguma ONG? Igreja? Sindicato? Entidade;1581340907000;5
@marcoaureliop ; @JovemPanNews Existe uma confusão de entendimento,  o Estado é laico n para proteger o estado e sim a religião,  pois que tem o poder da força é o Estado. Alguém podr imaginar se alegando a laicidade do ESTADO fazer o que a revolução francesa fez, obrigar a igreja a jurar lealdade ao ESTADO;1581340249000;5
@karolindt ; Isso é verdade. A sociedade desconhece o trabalho da igreja, simplesmente porque ele não pede pra si atenção. Por causa disso parece não existir, mas não se enganem. https://t.co/fLnhq2gh7V;1581339981000;5
@sffloriano ; Não me entra na cabeça a pessoa que se diz tão cheia de Deus e vive dentro da igreja ser a primeira a te apontar o dedo e te fazer só defeitos. Onde ficou todo o amor que ela prega? Toda a "vida cheia de Deus" que ela diz ter? De que adianta viver na igreja e ter a alma vazia 🤷🏻‍♀️;1581339977000;5
@Defato_rn ; Igreja Católica de se posicionar em relação à reforma da Previdência estadualhttps://t.co/GeJCSWv1xZ;1581339128000;5
@BetoAguilera ; @erahsfeliz Sábado passado em um encontro Igreja e Movimentos Sociais um Companheiro do tipo Tiozão do Pavê fez piadinha com o sorteio de uma cesta de brindes dizendo que tinha cachaça mas que se o ganhador fosse da Pastoral da Sobriedade era pra ficar só com a garrafa de mel. Até quando?;1581338952000;5
@isapassini ; @yeshuasave porq a gente viu o quanto era ruim tá em um lugar onde vc não é enturmado no assunto deles, hj a gente conhece quase todos jovens da igreja porq quando cada um chegou a gente recebeu eles, e é muito loco isso porq até então a gente era as pessoas que não se enturmava;1581338860000;5
@AndradeGaia ; @A_Paz_de_Cristo @caiouchoareal Vamos falar de como as ideias humanas tomaram o lugar das ordens de Deus ao longo destes dois séculos na igreja que nasceu do trabalho dos apóstolos mas veio, lenta e firmemente, se afastando da Palavra de Deus?;1581338852000;5
@eberjamil ; Se você deseja ser sábio e ter uma vida íntegra, mas olha para a Escola Bíblica como mais um evento da igreja, entenda que ela é a escola do saber de Deus. Uma escola que está preocupada com quem você foi, com o que você é e com o que você será. https://t.co/0fmy6q9fTh;1581338793000;5
@CATRACABIKE ; @leandroruschel A igreja é um lixo por si só. Não precisa da ajuda de papa comunista. Se o papa fosse de direita a merda nao seria muito diferente;1581338779000;5
@a_amanda_gomes ; @madeiradez Nessas horas, fico tão feliz de já ter passado ESSA fase da vida!! Sempre que vou ao forum, passo na frente da Damásio e lembro de agradecer! Tipo fazer cruz na frente da igreja!Se não fossem vcs, eu não poderia falar isso! Real! Forever grateful!;1581338610000;5
@israel_ocanha ; É que o marido/pai não tem um tempo de descanso para a família. Ele está tão atolado com as coisas da igreja que além de não ficar em casa, quando fica também é pra resolver questões da igreja. E numa dessas ao longo dos anos muitos filhos de pastor se desviaram;1581338254000;5
@victoraas ; @alvarodias_ E os 2,5 bilhōes que ele ia se apropriar da Petrobras? Vc reclamou por acaso? Dallagnol não presta!! Espero que alguém tenha coragem de pixar a Igreja do Bacacheri como sinal de aviso para esse abusador de autoridade!!!;1581338215000;5
@AllAboutSe1 ; @T7agoxOficial Tentar?? Eles têm de SER répares se não vão a acabar a fazer diçetraks como a costa angi ou vão cantar pra queles bares de velhos q só vão pra lá jogar ás cartas ou fugir da mulher q o obriga a ir com ela a igreja rezar o terço (digo isto com base nos meus avós  XD);1581337762000;5
@roneipessoa ; A igreja se reunia,( Hebreus10: 24 e 25 ) animando uns aos outros a permanecerem firmes diante da perseguição dos religiosos.;1581337433000;5
@thiraeder ; @lleticiaolipi Não quero entrar em questões religiosas, mas deveria se papel da igreja orar pelas pessoas que governam o país, e não fazer críticas contra as mesmas. (Coisa que CLARAMENTE o moço desse print faz);1581337336000;5
@MayaraSilvaa05 ; Se vc e um cristão e chega nos lugares e fica tratando as pessoas com indiferença por causa da opção sexual deles ou pq não estão na igreja, vc está sendo um péssimo cristão ...😑;1581337213000;5
@Heysweetiest ; Na fila do ônibus, o povo catando assinatura pro partido do biroliro. Vi gente de Jesus assinandoGnt de Jesus q faz faculdade (privada), então deveria ter o mínimo de senso.Pois se tem uma coisa que n me arrependo é ter saído da igreja Povo hipócrita/burro do carai;1581337197000;5
@itimaliaforks ; um presidente que se diz ser igreja precisa entender que o papel da igreja desde a velha aliança é trazer igualdade e justiça social para todos os povos. e eu vou cobrar. já cobrava e antes e vou cobrar ainda mais agora por um governo que viva justiça e não ego, ganância..;1581337169000;5
@rpdasilveira ; @ECantanhede Política e religião não devem se misturar. Hoje toda cidade tem pelo menos 1 vereador evangélico eleito só para atender os interesses da igreja. No demais a população que se dane!;1581336999000;5
@EsteGeovana ; A caminho do curso encontrei uma moça la da igreja e de longe a comprimentei, quando ia dar comtinuidade ao caminho, ouvi o espirito santo me dizer "atravessa e dê um abraço nela" e eu fiquei sem entender.... quando atravessei e a abracei, ela se desmanchou em lagrimas... 😭❤️;1581336993000;5
@SasoriGui ; Os dois papas (2019)Resumo: Papa hannibal trocando ideia com o papa argentino.Critica: Filme diferenciado bem paradex, se você gosta de igreja esse filme é pra você, se você nao gosta também porque da uma ideia massa de qualé a da igreja.Papa Score: 🙏 🙏 🙏 🙏 https://t.co/HryTextdI0;1581336479000;5
@niigeer ; @EtiatosR @folha Isso se não dá em cima das mulheres casadas na igreja......achando q é o dono da verdade. ....cuzão hipócrita!;1581336284000;5
@DudaWilpert ; Tava conversando com a guria nova da sala e ai ela fala: "nunca namore, só se for com alguém da igreja"KKKKKKKK como se mudasse alguma coisa, fui corna igual;1581335986000;5
@marciodapaz ; @tamycsol @brunasantini Oro para que "saia" da Igreja. Que verdadeiros discípulos de Cristo governem. Também oro para que os atuais governantes se tornem discípulos verdadeiros.;1581335554000;5
@tamycsol ; @marciodapaz @brunasantini O propósito de Deus quando criou o homem foi esse? O Reino de Deus que a gente pede no pai nosso é isso? Querido! Não se engane. Não tô dizendo que a gente tem que se revoltar e tentar acabar com os governos humanos. Mas apoia-los, fazer parte deles, colocá-los dentro da igreja?;1581335356000;5
@deboramd2 ; Dou minha cara a tapa se a maioria das pessoas que estão falando mal do the send não são crentes fora da igreja, que ficam teologizando aqui no Twitter achando que estão fazendo muito pra Deus!;1581335118000;5
@crf__bia ; @pretinho_Ng e é por isso que as pessoas se afastam da igreja, infelizmente. mas não liga, continua indo pelo propósito que você começou, vai dar tudo certo ❤️;1581334733000;5
@MMateusmuniz ; E que queria ter mais dois filhos que se chamariam (atenção): Lucas e João Essa mulher é uma louca da bíblia e nem na igreja vai;1581334686000;5
@Lukinha53173331 ; @coeronald Mano deixa os crentes cantar, deixa o pessoal da umbanda cantar, deixa o pessoal do carnaval também. Todo mundo se diverte do seu jeito.  Pra que ficar aí se ofendendo. E você pessoal da igreja parem de dar pérolas... (Sabem como termina o verso);1581334585000;5
@NetMane ; Qd for grande quero ser alguém na vida. Alguém mesmo, não um filho da puta q se aproveita da ignorância de muitos, para aprovar leis, para q a pedofilia na igreja não seja considerada crime.;1581334467000;5
@issuesbaby ; *vídeo de gente louvando na igreja*vcs: nOsSa mAs iMAgiNa sE foSSe dA uMbaNdA nEaH;1581334463000;5
@_lehborges17 ; indecisa no nível 100% se vou no acampa da igreja ou não🙁🙁🙁 flt poucos dias e eu ainda nao decidi, vtmnc;1581334400000;5
@mantunes75 ; @mjmacul_lima @marguimara @CNBBNacional Se você conhecesse a história da igreja católica saberia que ela sempre esteve ao lado dos poderosos e dos bandidos. Sempre, é histórico e esta documentado. Sempre ao lado de reinados orientando reis em suas conquistas. Fora assassinatos em massa conduzidos por ela. Td normal.;1581334149000;5
@Nunesvivixe ; Se eu tiver que sair do ministério de música da igreja,vou ficar muito triste,de vdd;1581333684000;5
@srt_marie ; E meus amigos da igreja que falaram "é fácil dar presente de aniversário pra Mari. É só ir na louvada e montar o kit" Não sei se fico feliz por me conhecerem assim ou preocupada com minha reputação até na igreja kkkkkkkkkkj;1581333384000;5
@a_sincerao ; @petracostal @oscars Kkkkkkk vc ganhou o que se ganha atras da igreja kkkkkkk adivinha o que kkkkkkkk#PetraCostaLiar;1581331382000;5
@AdoradoresT ; Seja forte e corajoso ,conselho para todos da igreja ...Pra mim : O poder de Deus se aperfeiçoa na sua fraqueza ...;1581331326000;5
@blurrygangsta ; caralho viado se eu to na igreja e escuto o pastor falar uma merda dessas eu ia subir naquilo alí com tanto sangue nos olhos que um filha da puta desse não ia ter garganta mais pra dizer mais merda nenhuma https://t.co/eLOmjQu6SX;1581330641000;5
@silvana84294542 ; Oi gente nessa vida tennhe gente que  sò pensa fazer maldade não quer sai da igreja pra fazer maldade não quer saber de Deus quer fazer por causa dinheiro celular bem material eita tà td errada mas não quer se conccetar;1581329617000;5
@gandalfsmelon ; Claro que queremos, ou vamos querer a decadência da Tradição e da Igreja? Querer algo que sempre foi não é um erro e graças a Deus estão se tocando nisso. https://t.co/zIJognGdEA;1581329583000;5
@theoliveto ; @KoskurKenson Se eu não me engano, o Jesus Culture e o Bethel é praticamente a mesma coisa, pessoal e tudo da mesma igreja;1581329417000;5
@lexandregabriel ; Passando aqui enfrente a igreja da sé e escutando essa  https://t.co/pEFiVXiAk5;1581328941000;5
@Fabily1981 ; @CarlosMateus28 @Haddad_Fernando Na certa você não, é do tipo cuidador de vida alheia. Se igreja resolvesse algo, não teria tantos fiéis escondido atrás da Bíblia...;1581328285000;5
@maisumaarroba ; bixo tipo vai se fodee muuuuito ate no retiro de igreja eles dão o remédio assim oh bunitinho na sua mão trás até o copinho de água junto mas a imunda da globo não eh CAPAZ https://t.co/p1VUJ4noDV;1581327976000;5
@OctaviaButlerfi ; @tiojoaobigon Comecei a te seguir, não sou evangélica, mas desde que a igreja se converteu ao deus da Política não deixo eles nem entrar na minha casa para orar, ou qdo me param na rua digo quen não tenho título de eleitor. Fui numa formação q. O tema era a vida de Cristo e vc foi certeiro.;1581327376000;5
@blesqbl0m ; se eu fosse da universal tudo seria mais fácileu teria votado no bozoteria feito qualquer curso de graduação, mas que me garantiria empregoeu só me preocuparia com o dízimo da igrejaescolheria esperar;1581326875000;5
@Gih_Ximenes1 ; E meu sogro ontem estava falando q lembrou de mim na igreja pq tinha uma criança comendo amarelão. Falou assim msm "Lembrei de vc,tinha uma menina comendo amarelão de cebola la na igreja,se tu tivesse lá ia pegar da criança" kkkkkAí amo essa família ❤❤;1581324832000;5
@conceicaovii ; @victor_leta @acnedallas @_S_Ricardo Não acho, por isso coloquei.Desrespeitoso é você vim no meu comentário e falar que é desrespeitoso.Coloquei uma parte que diz que vamos fazer o que ainda dá, porque se depender da maioria aí já não pode mais fazer. Daqui a pouco vocês acharão ruim até na igreja.;1581324286000;5
@PFAntunes ; A hipocrisia da igreja é impressionante. Como vêem q o sentido é pela legalização da eutanásia, tem de ser referendo, onde o seu populismo e argumentário beato e subjectivo funciona melhor. Criar entropia.Decisões individuais que afectam apenas o próprio não se devem referendar. https://t.co/kmSk6YCg3O;1581322205000;5
@bessoniy_01 ; você pode estar dentro ou fora da Igreja pra isso. vc só precisa deixar ela tomar conta do lugar! e qnd ela chegar CONTEMPLE - A não é q ela precise disso, é pq é INEVITÁVEL se vc se permitir! apenas deixe - a. de total liberdade para Ele, dance, cante, fale línguas+;1581322051000;5
@vanitasxx ; ontem fiquei tão feliz quando encontrei minha ex  líder da celula da igreja, ela tinha se assumido lésbica e tava lá com a namorada com tanta cara de feliz, deixou meu coração quentinho;1581319489000;5
@_vham__ ; @_tuamaede4 Sou da opinião deus foi criado por fins lucrativos. Isto fica tudo melhor se tiveres de dar uma moeda à Igreja, se não deres vais pro inferno que te lixas.;1581316363000;5
@pwrarig ; eu: tenho vergonha de vlt pra igreja dps de tanto tempo longecrente: jesus sempre estará lá por você... MAS VC SÓ PROCURA ELE QND PRECISAprecisa do teu cu, vai pro caralho, se mete na vida alheia e ainda quer dar pitaco como se fosse o dono da verdade, não fode “irmão”👍🏻;1581316161000;5
@uuranosx ; ué, no gc não pode um casal lésbico, mas pode um casal de hétero se comendo na entrada da igreja, beloved???????;1581315255000;5
@uuranosx ; puta coisinha hipócrita né, julgaram a minha amiga por namorar uma menina dentro da igreja, e viram um casal hétero se comendo mas não falaram nada kkkkkkkkkkk pqp, por isso não gosto de igrejas;1581315197000;5
@nubobot42 ; seria mesmo mto bizarro se esse pessoal q INVENTOU tocar musica dentro da igreja nao tivesse no minimo uma duvida sobre essa patifaria de "avivamento" usando vocabulos fascistas. se ate isso vai ser chamado de "esquerda evangelica", vai saber q q é ser evangelico pra essa glr;1581313340000;5
@yasmin_luize20 ; @MarceUtt aaah kkkkk meu tt não eh algo que eu goste de mostrar p qlqr pessoa, ate pq eu me exponho bastante qnd to triste e tal.. mas uma vez, ouvi uma menina da igreja falar "quer saber como alguém realmente é? vá no twitter dela" sendo q tipo? se qlqr pessoa quiser ver, fique a vntd;1581312904000;5
@CamilaFrrz ; @RafaelR95442632 @petracostal @oscars Olha, certa vez sofri um seqüestro-relâmpago. Dois criminosos, eu e uma colega que chama todos 'irmão, irmã'. Um dos marginais perguntou se ela era 'da igreja'. Este ficou quieto. O outro, um louco. Acho que temer o inferno ou a ira de Deus, sei lá, inibe certos instintos.;1581312668000;5
@MarceUtt ; @yasmin_luize20 Se a pessoa e da igreja e apoia ótimo;1581312543000;5
@Ariadne9706 ; Cr q desânimo horrível, mas é incrível cm as pessoas fazem vc desanimar da igreja, ñ é por Deus, Deus é pfft.. mas as pessoas precisam entender q tem que ter amor ao próximo, a dor das outras pessoas importa sim. Nem sempre vcs estão certos e se tiverem n pise ou humilhe ninguém;1581311475000;5
@frozem_ ; @AnaluuCEC Certeza , acho que o bonito sabe disso tanto quanto a gente que em um possível paredão a prova do bate e volta da Bianca vai ser como se maquiar em 20 min. Pois ele n pode deixar ela sair,ela saindo aquilo ali vira uma igreja;1581311033000;5
@gabieuly ; Se fude mano não era o menino da igreja;1581311011000;5
@machadodg_ ; Hoje minha chefe venho me falar da história do pq se usar escapulário né, ai falei pra ela q não acreditava na igreja branca europeia e que usava só pra bonito. Ela se mordeu kkk;1581310771000;5
@Vagnao10000 ; já pensou para pensar se muitos usassem a  mesma empolgação pra servir dentro da sua igreja? Estão colocando muita ênfase em um evento, o centro de tudo sempre foi Jesus...;1581309922000;5
@werneckhalifa ; Vou passar a virada do meu niver no Salgueiro e domingo vou ficar sossegado, se pa ir a igreja da minha mãe;1581309836000;5
@SaamanthaDuque ; Dei as instruções pra ele de como procurar a matriz da igreja em que ele queria se envolver. Encerrei o assunto e ele me perguntou “ você não quer muita conversa né?” Eu não respondi.;1581309025000;5
@plazzzzza ; todo mundo falando de encontro da igreja, foi se o tempo q eu tinha interesse nisso;1581308894000;5
